### ISSUE TITLE
Doorbird hangs itself up after a few hours 

### ISSUE THREAD

**Issue by Vicelow** [koush/scrypted#1480]
I run a Doorbird camera since 2 years without problems via Scrypted and HKSV, but since 2 weeks the camera stops responding in HK after a few hours. It can be resolved through reloading the plugin in Scrypted. Is this related to the other open ticket on a similar issue or a new one? (see camera console output attached)

Just weird that it worked flawlessly for 2 years before this.

Many thanks!

5/22/2024, 6:42:31 AM
########################
[Rebroadcast Plugin]: sending prebuffer 6000
[Rebroadcast Plugin]: Unable to find sync frame in rtsp prebuffer.
[Snapshot Plugin]: Snapshot failed Error: ffmpeg input to image conversion failed with exit code: 234, /server/node_modules/@scrypted/ffmpeg-static/artifacts/ffmpeg-linux-x64 -hide_banner -err_detect aggressive -fflags discardcorrupt -y -analyzeduration 0 -probesize 500000 -reorder_queue_size 0 -rtsp_transport tcp -f rtsp -i rtsp://127.0.0.1:40526/dee70aba8814eda8/22 -frames:v 1 -f image2 pipe:3
[Snapshot Plugin]:     at /src/ffmpeg-image-filter.ts:177:23
[Snapshot Plugin]:     at processTicksAndRejections (node:internal/process/task_queues:95:5)
[Snapshot Plugin]: creating error image with background Snapshot Failed true
[Rebroadcast Plugin]: sending prebuffer 6000
[Rebroadcast Plugin]: Unable to find sync frame in rtsp prebuffer.
[Snapshot Plugin]: Snapshot failed Error: ffmpeg input to image conversion failed with exit code: 234, /server/node_modules/@scrypted/ffmpeg-static/artifacts/ffmpeg-linux-x64 -hide_banner -err_detect aggressive -fflags discardcorrupt -y -analyzeduration 0 -probesize 500000 -reorder_queue_size 0 -rtsp_transport tcp -f rtsp -i rtsp://127.0.0.1:44310/22269e2f4ff0bb1b/22 -frames:v 1 -f image2 pipe:3
[Snapshot Plugin]:     at /src/ffmpeg-image-filter.ts:177:23
[Snapshot Plugin]:     at processTicksAndRejections (node:internal/process/task_queues:95:5)
[Snapshot Plugin]: creating error image with background Snapshot Failed true
[HomeKit]: snapshot error RPCResultError: ffmpeg input to image conversion failed with exit code: 8, /server/node_modules/@scrypted/ffmpeg-static/artifacts/ffmpeg-linux-x64 -hide_banner -y -f image2pipe -i pipe:4 -filter_complex eq=brightness=-0.2[snapshotBlur] ; [snapshotBlur] gblur=sigma=25[snapshotText] ; [snapshotText] drawtext=fontfile=/server/volume/plugins/@scrypted/snapshot/zip/unzipped/fs/Lato-Bold.ttf:text='Snapshot Failed':fontcolor=white:fontsize=h/8:x=(w-text_w)/2:y=(h-text_h)/2 -frames:v 1 -f image2 pipe:3
[HomeKit]:     at /src/ffmpeg-image-filter.ts:177:23
[HomeKit]:     at processTicksAndRejections (node:internal/process/task_queues:95:5)
[HomeKit]: @scrypted/snapshot:host
[HomeKit]: host:@scrypted/homekit {
[HomeKit]:   cause: undefined
[HomeKit]: }
[Rebroadcast Plugin]: sending prebuffer 6000
[Rebroadcast Plugin]: Unable to find sync frame in rtsp prebuffer.
[Snapshot Plugin]: Snapshot failed Error: ffmpeg input to image conversion failed with exit code: 234, /server/node_modules/@scrypted/ffmpeg-static/artifacts/ffmpeg-linux-x64 -hide_banner -err_detect aggressive -fflags discardcorrupt -y -analyzeduration 0 -probesize 500000 -reorder_queue_size 0 -rtsp_transport tcp -f rtsp -i rtsp://127.0.0.1:40420/f00f034cc83d5572/22 -frames:v 1 -f image2 pipe:3
[Snapshot Plugin]:     at /src/ffmpeg-image-filter.ts:177:23
[Snapshot Plugin]:     at processTicksAndRejections (node:internal/process/task_queues:95:5)
[Snapshot Plugin]: creating error image with background Snapshot Failed true
[HomeKit]: snapshot error RPCResultError: ffmpeg input to image conversion failed with exit code: 8, /server/node_modules/@scrypted/ffmpeg-static/artifacts/ffmpeg-linux-x64 -hide_banner -y -f image2pipe -i pipe:4 -filter_complex eq=brightness=-0.2[snapshotBlur] ; [snapshotBlur] gblur=sigma=25[snapshotText] ; [snapshotText] drawtext=fontfile=/server/volume/plugins/@scrypted/snapshot/zip/unzipped/fs/Lato-Bold.ttf:text='Snapshot Failed':fontcolor=white:fontsize=h/8:x=(w-text_w)/2:y=(h-text_h)/2 -frames:v 1 -f image2 pipe:3
[HomeKit]:     at /src/ffmpeg-image-filter.ts:177:23
[HomeKit]:     at processTicksAndRejections (node:internal/process/task_queues:95:5)
[HomeKit]: @scrypted/snapshot:host
[HomeKit]: host:@scrypted/homekit {
[HomeKit]:   cause: undefined
[HomeKit]: }

**Comment by digitalentropy** [comment]
I am seeing a similar behavior and it's maddening. Were you able to find any solutions?

**Comment by Vicelow** [comment]
Additional input for whoever can interpret this :-)
When the plugin starts, it complains about a deprecated buffer method. Maybe the issue?

linux x64 #69057 SMP Fri Jan 12 17:02:28 CST 2024
server version: 0.105.0
plugin version: @scrypted/doorbird 0.0.2
full
########################
5/24/2024, 7:30:30 AM
########################
starting plugin @scrypted/doorbird
node modules /server/volume/plugins/@scrypted/doorbird/node20-linux-x64-20240321
Doorbird: Our intercomId is:  ghhars
Doorbird: starting event socket listening...
plugin loaded
(node:4834) [DEP0005] DeprecationWarning: Buffer() is deprecated due to security and usability issues. Please use the Buffer.alloc(), Buffer.allocUnsafe(), or Buffer.from() methods instead.
(Use `node --trace-deprecation ...` to show where the warning was created)
Doorbird: starting audio silence generator...
-hide_banner -nostats -re -f lavfi -i anullsrc=r=8000:cl=mono -f mulaw pipe:3
Input #0, lavfi, from 'anullsrc=r=8000:cl=mono':
  Duration: N/A, start: 0.000000, bitrate: 64 kb/s
  Stream #0:0: Audio: pcm_u8, 8000 Hz, mono, u8, 64 kb/s
Stream mapping:
  Stream #0:0 -> #0:0 (pcm_u8 (native) -> pcm_mulaw (native))
Press [q] to stop, [?] for help
Output #0, mulaw, to 'pipe:3':
  Metadata:
    encoder         : Lavf60.16.100
  Stream #0:0: Audio: pcm_mulaw, 8000 Hz, mono, s16, 64 kb/s
    Metadata:
      encoder         : Lavc60.31.102 pcm_mulaw

Input #0, lavfi, from 'anullsrc=r=8000:cl=mono':
  Duration: N/A, start: 0.000000, bitrate: 64 kb/s
  Stream #0:0: Audio: pcm_u8, 8000 Hz, mono, u8, 64 kb/s
Stream mapping:
  Stream #0:0 -> #0:0 (pcm_u8 (native) -> pcm_mulaw (native))
Press [q] to stop, [?] for help
Output #0, mulaw, to 'pipe:3':
  Metadata:
    encoder         : Lavf60.16.100
  Stream #0:0: Audio: pcm_mulaw, 8000 Hz, mono, s16, 64 kb/s
    Metadata:
      encoder         : Lavc60.31.102 pcm_mulaw

**Comment by koush** [comment]
@slyoldfox I think maintains this plugin?

**Comment by slyoldfox** [comment]
@koush doorbird? no, just a bit of `sip` and the `bticino` plugin.

**Comment by stephanlinke87** [comment]
Observing the same behavior with two different doorbirds running the 142 firmware :)

**Comment by koush** [comment]
@nanosonde is the plugin developer. I think there were some rebroadcast changes a month ago but that's it.

**Comment by koush** [comment]
someone try rebroadcast version 0.10.17

**Comment by Vicelow** [comment]
> someone try rebroadcast version 0.10.17

Installed it and will observe now for 1-2 days

**Comment by stephanlinke87** [comment]
Same - so far, it works since 10h :)

**Comment by Optic00** [comment]
same here, has been working for 16 hours now on 0.10.17

**Comment by Vicelow** [comment]
> > someone try rebroadcast version 0.10.17
> 
> Installed it and will observe now for 1-2 days

Same here, up an running now for >24h

**Comment by stephanlinke87** [comment]
Down again unfortunately :( I‘ll check the logs later and post them.

**Comment by koush** [comment]
The change in 17 was a periodic restart that was removed. I think this has always been an issue, but was just masked due to that restart.

**Comment by stephanlinke87** [comment]
Just figured that the plugin got updated to 18 via autoupdate again xD From what I can tell, it's working fine with 17 :)

**Comment by nanosonde** [comment]
Hi!
Just a quick update from my side.
The plugin always had the described issue.
If you study the doorbird API docs closely, you will read that the native doorbird apps take precedence over any API functionality.
So this might be an issue as well.
Also the plugin is missing advanced error handling code if the streams get interrupted somehow. They do not recover from such a failure.
When I was using scrypted, I have used it for just for 2-way audio Video-Doorbell in Homekit. This worked out. I also experienced the described issue, but only with active rebroadcasting plugin which consumes the doorbird streams permanently. Later I have disabled the rebroadcasting plugin, as homekit stream setup was fast enough for me without it.

It might be that the doorbird closes the stream after some fixed time as well. Also using the doorbird apps might cause this.

I am not using scrypted anymore as I habe moved to frigate+HAOS and the native doorbird apps.

So sorry to say that I won‘t work on this anymore as I do not have any spare time for it.

**Comment by koush** [comment]
> I am not using scrypted anymore as I have moved to frigate+HAOS and the native doorbird apps.

Doesn't frigate also keep the stream open on door bird? Or are you not recording the doorbird? The easiest fix here may be to simply disable pre buffering on door bird by default, and I can do that myself.

**Comment by nanosonde** [comment]
@koush 
Yes, you are right. I am using the same RTSP URL as it is used in the doorbird plugin.
go2rtc consumes the stream for very long times without any issues.
So the video streaming should not be an issue.

As far as I remember while implementing the doorbird plugin, I had an issue with audio streaming as described here:
https://www.doorbird.com/downloads/api_lan.pdf

How does the doorbird plugin work in general?
It permanently received the RTSP video-only stream from the doorbird.
As resulting output for scrypted must contain video and audio at the same time, I had come with the idea that I use a silence generator that generates a silent audio stream when the scrypted intercom is inactive.
As soon as the intercom gets activated the audio input us switched from silence generator to the doorbird audio receiver. The audio receiver does not use SIP, but instead uses the HTTP as described in the LAN API PDF.

The problem I had once was that the HTTP audio receiver stopped receiving audio packets for whatever reason (mayb the issue that is decribed here?). If this happens, the ffmpeg instance does not die, but instead stops outputing the combined A+V streams although the received doorbird video stream is still fine.
In some other issue I wrote that one probably would have to write a custom HTTP doorbird audioreceiver that is more tailored for the doorbird HTTP audio RX instead of relying on the other FFMPEG instance with HTTP input. See this code: https://github.com/koush/scrypted/blob/main/plugins/doorbird/src/main.ts#L239

Maybe you could check the logs of this FFMPEG instance for HTTP audio RX to see if it is still alive and receiving/outputing audio frames.

So just to sum it up for the doorbird plugin: we have four ffmpeg instances running:
1) one for the silence generator that outputs silence on pipe:3
2) one for audio RX from doorbird that outputs doorbird audio on pipe:3
3) one for audio TX that sends audio from scrypted to doorbird via HTTP
4) one for video RX from doorbird combined with audio input via TCP from plugin's internal TCP audio server that either receives data from 1) or 2)

If 2) does not receive any audio data anymore via HTTP, then 4) stops processing and does not output anything. -> No video, no audio. This is probably the issue you experience here.

Possible solution would be to add make audio RX via HTTP for 2) more robust and either restart it or just fallback to silence from silence generator.

Please note also that the doorbird API clearly states that any Doorbird APP would have priority over the API stuff.
So the described possible solution above would be required anyway if a mixed usage of Doorbird App and Doorbird API is desired.

**Comment by stephanlinke87** [comment]
Just as an fyi, it has been working for four days straight now :)

**Comment by digitalentropy** [comment]
Thank you everyone for investigating this!

As an aside, what are some of the functional differences between the ONVIF plugin and the DoorBird-specific plugin? I ended up switching to ONVIF plugin as a test and it appears to be functioning smoothly.

**Comment by nanosonde** [comment]
> Thank you everyone for investigating this!
> 
> As an aside, what are some of the functional differences between the ONVIF plugin and the DoorBird-specific plugin? I ended up switching to ONVIF plugin as a test and it appears to be functioning smoothly.

The doorbird ONVIF does not support two-way audio as it does not support ONVIF profile-T with RTSP audio backchannel support.
This is the main reason why I wrote the doorbird specific plugin. I wanted to use it with Scrypted&Homekit as two-way-audio-video-doorbell.

**Comment by Vicelow** [comment]
> Just as an fyi, it has been working for four days straight now :)

Same here! Up and running since I reverted to the previous version

**Comment by Vicelow** [comment]
Has the Doorbird connection also stopped working for someone else? All of a sudden, the stream is not working for me at all

**Comment by Vinisz** [comment]
I tired above "solutions" but still issues with the doorbird plugin, the stream just stops working after couple of hours and it's not reliable at the moment

**Comment by nsowen** [comment]
**Bump**

I'm on Scrpyted 0.139.0. After some hours the Stream cannot be established anymore and "Snapshot failed" is displayed in the still image. Once the Doorbird Plugin is restarted, it will work for a few hours again.

In Camera-Log:

```
[Rebroadcast Plugin]: RTSP Rebroadcast connection started.
[Rebroadcast Plugin]: request headers DESCRIBE rtsp://localhost:41433/1d53222c45c3e8b0 RTSP/1.0
[Rebroadcast Plugin]: CSeq: 1
[Rebroadcast Plugin]: Accept: application/sdp
[Rebroadcast Plugin]: Require: www.onvif.org/ver20/backchannel
[Rebroadcast Plugin]: User-Agent: go2rtc/1.9.9
[Rebroadcast Plugin]: response headers RTSP/1.0 200 OK
[Rebroadcast Plugin]: Content-Base: rtsp://localhost:41433/1d53222c45c3e8b0
[Rebroadcast Plugin]: Content-Type: application/sdp
[Rebroadcast Plugin]: CSeq: 1
[Rebroadcast Plugin]: Content-Length: 349
[Rebroadcast Plugin]: response body v=0
[Rebroadcast Plugin]: o=- 0 0 IN IP4 127.0.0.1
[Rebroadcast Plugin]: s=RTSP/RTP stream from DoorBird
[Rebroadcast Plugin]: c=IN IP4 127.0.0.1
[Rebroadcast Plugin]: t=0 0
[Rebroadcast Plugin]: a=tool:libavformat 61.7.100
[Rebroadcast Plugin]: m=video 0 RTP/AVP 96
[Rebroadcast Plugin]: a=rtpmap:96 H264/90000
[Rebroadcast Plugin]: a=fmtp:96 packetization-mode=1; sprop-parameter-sets=Z0IAH5Y1QKALdNwEBAQI,aM48gA==; profile-level-id=42001F
[Rebroadcast Plugin]: a=control:streamid=0
[Rebroadcast Plugin]: m=audio 0 RTP/AVP 0
[Rebroadcast Plugin]: b=AS:64
[Rebroadcast Plugin]: a=control:streamid=1
[Rebroadcast Plugin]: request headers SETUP rtsp://localhost:41433/1d53222c45c3e8b0/streamid=0 RTSP/1.0
[Rebroadcast Plugin]: Transport: RTP/AVP/TCP;unicast;interleaved=0-1
[Rebroadcast Plugin]: CSeq: 2
[Rebroadcast Plugin]: response headers RTSP/1.0 200 OK
[Rebroadcast Plugin]: Session: 38aece69
[Rebroadcast Plugin]: Transport: RTP/AVP/TCP;unicast;interleaved=0-1
[Rebroadcast Plugin]: CSeq: 2
[Rebroadcast Plugin]: request headers TEARDOWN rtsp://localhost:41433/1d53222c45c3e8b0 RTSP/1.0
[Rebroadcast Plugin]: CSeq: 4
[Rebroadcast Plugin]: Session: 01e36937
[Rebroadcast Plugin]: response headers RTSP/1.0 200 OK
[Rebroadcast Plugin]: Session: 01e36937
[Rebroadcast Plugin]: CSeq: 4
[Rebroadcast Plugin]: RTSP Rebroadcast connection finished.
[Rebroadcast Plugin]: default active rebroadcast clients: 0
[Rebroadcast Plugin]: request headers PLAY rtsp://localhost:41433/1d53222c45c3e8b0 RTSP/1.0
[Rebroadcast Plugin]: CSeq: 3
[Rebroadcast Plugin]: Session: 38aece69
[Rebroadcast Plugin]: response headers RTSP/1.0 200 OK
[Rebroadcast Plugin]: RTP-Info: url=rtsp://localhost:41433/1d53222c45c3e8b0/streamid=0
[Rebroadcast Plugin]: Range: npt=now-
[Rebroadcast Plugin]: Session: 38aece69
[Rebroadcast Plugin]: CSeq: 3
[Rebroadcast Plugin]: default active rebroadcast clients: 1
[Rebroadcast Plugin]: Unable to find sync frame in rtsp prebuffer.
```

or in Rebroadcast-Log:

```
[DoorBird D1101FV-F-RAL7016] default active rebroadcast clients: 1
[DoorBird D1101FV-F-RAL7016] external rtsp client ::1 41433
[DoorBird D1101FV-F-RAL7016] RTSP Rebroadcast connection started.
[DoorBird D1101FV-F-RAL7016] request headers DESCRIBE rtsp://localhost:41433/1d53222c45c3e8b0 RTSP/1.0
Accept: application/sdp
Require: www.onvif.org/ver20/backchannel
User-Agent: go2rtc/1.9.9
CSeq: 1
[DoorBird D1101FV-F-RAL7016] response headers RTSP/1.0 200 OK
Content-Base: rtsp://localhost:41433/1d53222c45c3e8b0
Content-Type: application/sdp
CSeq: 1
Content-Length: 349

[DoorBird D1101FV-F-RAL7016] response body v=0
o=- 0 0 IN IP4 127.0.0.1
s=RTSP/RTP stream from DoorBird
c=IN IP4 127.0.0.1
t=0 0
a=tool:libavformat 61.7.100
m=video 0 RTP/AVP 96
a=rtpmap:96 H264/90000
a=fmtp:96 packetization-mode=1; sprop-parameter-sets=Z0IAH5Y1QKALdNwEBAQI,aM48gA==; profile-level-id=42001F
a=control:streamid=0
m=audio 0 RTP/AVP 0
b=AS:64
a=control:streamid=1

[DoorBird D1101FV-F-RAL7016] request headers SETUP rtsp://localhost:41433/1d53222c45c3e8b0/streamid=0 RTSP/1.0
Transport: RTP/AVP/TCP;unicast;interleaved=0-1
CSeq: 2
[DoorBird D1101FV-F-RAL7016] response headers RTSP/1.0 200 OK
Session: b7fa5cc8
Transport: RTP/AVP/TCP;unicast;interleaved=0-1
CSeq: 2

[DoorBird D1101FV-F-RAL7016] Unable to find sync frame in rtsp prebuffer.
[DoorBird D1101FV-F-RAL7016] request headers PLAY rtsp://localhost:41433/1d53222c45c3e8b0 RTSP/1.0
CSeq: 3
Session: b7fa5cc8
[DoorBird D1101FV-F-RAL7016] response headers RTSP/1.0 200 OK
RTP-Info: url=rtsp://localhost:41433/1d53222c45c3e8b0/streamid=0
Range: npt=now-
Session: b7fa5cc8
CSeq: 3

[DoorBird D1101FV-F-RAL7016] default active rebroadcast clients: 2
[DoorBird D1101FV-F-RAL7016] request headers TEARDOWN rtsp://localhost:41433/1d53222c45c3e8b0 RTSP/1.0
CSeq: 4
Session: d81ec658
[DoorBird D1101FV-F-RAL7016] response headers RTSP/1.0 200 OK
Session: d81ec658
CSeq: 4

[DoorBird D1101FV-F-RAL7016] RTSP Rebroadcast connection finished.
```

Once I restart the Doorbird plugin, everything works fine again.

```
linux arm64 #1 SMP PREEMPT Debian 1:6.12.34-1+rpt1~bookworm (2025-06-26)
server version: 0.139.0
plugin version: @scrypted/doorbird 0.0.4
full
########################
7/17/2025, 10:49:09 AM
########################
Doorbird: Our intercomId is: [REDACTED]
Doorbird: starting event socket listening...
[Rebroadcast Plugin]: prebuffer sessions starting in 5 seconds
[Rebroadcast Plugin]: default prebuffer session started
[Rebroadcast Plugin]: default prebuffer session starting
[Rebroadcast Plugin]: -hide_banner -fflags +genpts -analyzeduration 0 -probesize 32 -fflags nobuffer -flags low_delay -f rtsp -rtsp_transport tcp -i rtsp:[REDACTED] -f mulaw -ac 1 -ar 8000 -channel_layout mono -use_wallclock_as_timestamps true -i tcp:[REDACTED] -rtsp_transport tcp -vcodec copy -acodec copy -pkt_size 32000 -f rtsp rtsp://127.0.0.1:35931/76b0a5adfd07db0d
[Rebroadcast Plugin]: [rtsp @ 0x557c24adb0] Stream #0: not enough frames to estimate rate; consider increasing probesize
[Rebroadcast Plugin]: Input #0, rtsp, from 'rtsp://[REDACTED]@doorbird.internal/mpeg/media.amp':
[Rebroadcast Plugin]:   Metadata:
[Rebroadcast Plugin]:     title           : RTSP/RTP stream from DoorBird
[Rebroadcast Plugin]:     comment         : mpeg/720p/media.amp
[Rebroadcast Plugin]:   Duration: N/A, bitrate: N/A
[Rebroadcast Plugin]:   Stream #0:0: Video: h264 (Baseline), yuvj420p(pc, bt709, progressive), 1280x720, 90k tbr, 90k tbn
Doorbird: starting audio silence generator...
Input #0, lavfi, from 'anullsrc=r=8000:cl=mono':
  Duration: N/A, start: 0.000000, bitrate: 64 kb/s
  Stream #0:0: Audio: pcm_u8, 8000 Hz, mono, u8, 64 kb/s
Stream mapping:
  Stream #0:0 -> #0:0 (pcm_u8 (native) -> pcm_mulaw (native))

Press [q] to stop, [?] for help

Output #0, mulaw, to 'pipe:3':
  Metadata:
    encoder         : Lavf61.7.100

  Stream #0:0: Audio: pcm_mulaw, 8000 Hz, mono, s16 (8 bit), 64 kb/s
      Metadata:
        encoder         : Lavc61.19.101 pcm_mulaw

[Rebroadcast Plugin]: Input #1, mulaw, from 'tcp://127.0.0.1:44265?tcp_nodelay=1':
[Rebroadcast Plugin]:   Duration: N/A, start: 1752749350.526125, bitrate: 64 kb/s
[Rebroadcast Plugin]: Stream #1:0: Audio: pcm_mulaw, 8000 Hz, mono, s16, 64 kb/s
[Rebroadcast Plugin]: Stream mapping:
[Rebroadcast Plugin]:   Stream #0:0 -> #0:0 (copy)
[Rebroadcast Plugin]:   Stream #1:0 -> #0:1 (copy)
[Rebroadcast Plugin]: sdp received from ffmpeg v=0
[Rebroadcast Plugin]: o=- 0 0 IN IP4 127.0.0.1
[Rebroadcast Plugin]: s=RTSP/RTP stream from DoorBird
[Rebroadcast Plugin]: c=IN IP4 127.0.0.1
[Rebroadcast Plugin]: t=0 0
[Rebroadcast Plugin]: a=tool:libavformat 61.7.100
[Rebroadcast Plugin]: m=video 0 RTP/AVP 96
[Rebroadcast Plugin]: a=rtpmap:96 H264/90000
[Rebroadcast Plugin]: a=fmtp:96 packetization-mode=1; sprop-parameter-sets=Z0IAH5Y1QKALdNwEBAQI,aM48gA==; profile-level-id=42001F
[Rebroadcast Plugin]: a=control:streamid=0
[Rebroadcast Plugin]: m=audio 0 RTP/AVP 0
[Rebroadcast Plugin]: b=AS:64
[Rebroadcast Plugin]: a=control:streamid=1
[Rebroadcast Plugin]: Output #0, rtsp, to 'rtsp://127.0.0.1:35931/76b0a5adfd07db0d':
[Rebroadcast Plugin]:   Metadata:
[Rebroadcast Plugin]:     title           : RTSP/RTP stream from DoorBird
[Rebroadcast Plugin]:     comment         : mpeg/720p/media.amp
[Rebroadcast Plugin]:     encoder         : Lavf61.7.100
[Rebroadcast Plugin]:   Stream #0:0: Video: h264 (Baseline), yuvj420p(pc, bt709, progressive), 1280x720, q=2-31, 90k tbr, 90k tbn
[Rebroadcast Plugin]:   Stream #0:1: Audio: pcm_mulaw, 8000 Hz, mono, s16, 64 kb/s
[Rebroadcast Plugin]: Press [q] to stop, [?] for help
[Rebroadcast Plugin]: [aost#0:1/copy @ 0x557c2ce910] Non-monotonic DTS; previous: 415, current: 413; changing to 416. This may result in incorrect timestamps in the output file.
[Rebroadcast Plugin]: [aost#0:1/copy @ 0x557c2ce910] Non-monotonic DTS; previous: 416, current: 413; changing to 417. This may result in incorrect timestamps in the output file.
[Rebroadcast Plugin]: [aost#0:1/copy @ 0x557c2ce910] Non-monotonic DTS; previous: 417, current: 413; changing to 418. This may result in incorrect timestamps in the output file.
[Rebroadcast Plugin]: [aost#0:1/copy @ 0x557c2ce910] Non-monotonic DTS; previous: 418, current: 413; changing to 419. This may result in incorrect timestamps in the output file.
[Rebroadcast Plugin]: [aost#0:1/copy @ 0x557c2ce910] Non-monotonic DTS; previous: 419, current: 415; changing to 420. This may result in incorrect timestamps in the output file.
[Rebroadcast Plugin]: [aost#0:1/copy @ 0x557c2ce910] Non-monotonic DTS; previous: 420, current: 415; changing to 421. This may result in incorrect timestamps in the output file.
[Rebroadcast Plugin]: frame=    0 fps=0.0 q=-1.0 size=N/A time=00:00:00.58 bitrate=N/A speed=1.17x
[Rebroadcast Plugin]: video/audio detected, discarding further input
[Rebroadcast Plugin]: default active rebroadcast clients: 1
[Rebroadcast Plugin]: default active rebroadcast clients: 0
```

Starting stream via HomeKit:

```
[HomeKit]: HomeKit Connection 192.168.6.17
[HomeKit]: addresses {
[HomeKit]:   sourceAddress: '192.168.3.3',
[HomeKit]:   sourceVideoPort: 58184,
[HomeKit]:   sourceAudioPort: 34497,
[HomeKit]:   targetAddress: '192.168.6.17',
[HomeKit]:   targetVidioPort: 63719,
[HomeKit]:   targetAudioPort: 56839
[HomeKit]: }
[HomeKit]: handleStreamRequest {
[HomeKit]:   sessionID: 'ce37c18c-5e7c-4d5e-9614-6daf08ae1083',
[HomeKit]:   type: 'start',
[HomeKit]:   video: {
[HomeKit]:     codec: 0,
[HomeKit]:     profile: 1,
[HomeKit]:     level: 2,
[HomeKit]:     packetizationMode: 0,
[HomeKit]:     cvoId: undefined,
[HomeKit]:     width: 1280,
[HomeKit]:     height: 720,
[HomeKit]:     fps: 30,
[HomeKit]:     pt: 99,
[HomeKit]:     ssrc: 3522523397,
[HomeKit]:     max_bit_rate: 299,
[HomeKit]:     rtcp_interval: 0.5,
[HomeKit]:     mtu: 1378
[HomeKit]:   },
[HomeKit]:   audio: {
[HomeKit]:     codec: 'OPUS',
[HomeKit]:     channel: 1,
[HomeKit]:     bit_rate: 0,
[HomeKit]:     sample_rate: 24,
[HomeKit]:     packet_time: 20,
[HomeKit]:     pt: 110,
[HomeKit]:     ssrc: 1557651440,
[HomeKit]:     max_bit_rate: 24,
[HomeKit]:     rtcp_interval: 5,
[HomeKit]:     comfort_pt: 13,
[HomeKit]:     comfortNoiseEnabled: false
[HomeKit]:   }
[HomeKit]: }
[HomeKit]: Will wait for initial RTCP packet. { isHomeHub: undefined, isLowBandwidth: false, hasHomeHub: false }
[HomeKit]: { isLowBandwidth: false, isWatch: false, destination: 'local' }
[Adaptive Streaming]: Adaptive bitrate disabled. User not licensed.
[HomeKit]: { tool: undefined, rtpSender: 'Default' }
[HomeKit]: Waiting for video RTCP packet before sending video.
[HomeKit]: packet loss 1
[HomeKit]: Received first video RTCP packet.
[HomeKit]: a/v h264 opus found h264 undefined
[Rebroadcast Plugin]: default active rebroadcast clients: 1
[HomeKit]: -hide_banner -analyzeduration 0 -probesize 512 -i rtsp:[REDACTED] -acodec libopus -application lowdelay -frame_duration 20 -flags +global_header -ar 24k -b:a 24k -bufsize 96k -ac 1 -payload_type 110 -ssrc 5703326 -dn -sn -vn -f rtp rtp://127.0.0.1:40719?pkt_size=400 -sdp_file pipe:4
[HomeKit]: received first video packet
[HomeKit]: scanning for idr start found: 24 7 8
[HomeKit]: idr start found: 28 5
[HomeKit]: [rtsp @ 0x55a406adf0] method SETUP failed: 461 Unsupported Transport
[HomeKit]: [aist#0:0/pcm_mulaw @ 0x55a4070990] Guessed Channel Layout: mono
[HomeKit]: Input #0, rtsp, from 'rtsp://127.0.0.1:42475':
[HomeKit]: Metadata:
[HomeKit]:     title           : RTSP/RTP stream from DoorBird
[HomeKit]:   Duration: N/A, start: 0.000000, bitrate: 64 kb/s
[HomeKit]:   Stream #0:0: Audio: pcm_mulaw, 8000 Hz, mono, s16, 64 kb/s
[HomeKit]: Stream mapping:
[HomeKit]:   Stream #0:0 -> #0:0 (pcm_mulaw (native) -> opus (libopus))
[HomeKit]: Press [q] to stop, [?] for help
[HomeKit]: Output #0, rtp, to 'rtp://127.0.0.1:40719?pkt_size=400':
[HomeKit]:   Metadata:
[HomeKit]:     title           : RTSP/RTP stream from DoorBird
[HomeKit]:     encoder         : Lavf61.7.100
[HomeKit]:   Stream #0:0: Audio: opus, 24000 Hz, mono, s16, 24 kb/s
[HomeKit]:       Metadata:
[HomeKit]:         encoder         : Lavc61.19.101 libopus
[HomeKit]: video/audio detected, discarding further input
[HomeKit]: received first audio packet
```

Starting 2-way audio:

```
Doorbird: Starting audio receiver...
Doorbird: Starting audio transmitter...
Doorbird: audio transmitter started.
ffmpeg version 7.1.1 Copyright (c) 2000-2025 the FFmpeg developers
  built with gcc 13 (Ubuntu 13.3.0-6ubuntu2~24.04)
  configuration: --disable-decoder=amrnb --disable-gnutls --disable-liblensfun --disable-libopencv --disable-podpages --disable-sndio --disable-stripping --enable-avfilter --enable-chromaprint --enable-frei0r --enable-gcrypt --enable-gpl --enable-ladspa --enable-libaom --enable-libaribb24 --enable-libass --enable-libbluray --enable-libbs2b --enable-libcaca --enable-libcdio --enable-libcodec2 --enable-libdav1d --enable-libdc1394 --enable-libdrm --enable-libdvdnav --enable-libdvdread --enable-libflite --enable-libfontconfig --enable-libfreetype --enable-libfribidi --enable-libgme --enable-libgsm --enable-libharfbuzz --enable-libiec61883 --enable-libjack --enable-libjxl --enable-libmp3lame --enable-libmysofa --enable-libopencore-amrnb --enable-libopencore-amrwb --enable-libopenh264 --enable-libopenjpeg --enable-libopenmpt --enable-libopus --enable-libplacebo --enable-libpulse --enable-librabbitmq --enable-librist --enable-librsvg --enable-librubberband --enable-libshine --enable-libsmbclient --enable-libsnappy --enable-libsoxr --enable-libspeex --enable-libsrt --enable-libsvtav1 --enable-libtesseract --enable-libtheora --enable-libtwolame --enable-libvidstab --enable-libvo-amrwbenc --enable-libvorbis --enable-libvpx --enable-libwebp --enable-libwebp --enable-libx264 --enable-libx265 --enable-libxml2 --enable-libxvid --enable-libzimg --enable-libzmq --enable-libzvbi --enable-lv2 --enable-nonfree --enable-openal --enable-opencl --enable-opengl --enable-openssl --enable-postproc --enable-pthreads --enable-shared --enable-version3 --incdir=/usr/include/aarch64-linux-gnu --libdir=/usr/lib/aarch64-linux-gnu --prefix=/usr --toolchain=hardened --enable-libvmaf --enable-librav1e --enable-libvvenc --enable-libilbc --enable-libklvanc --enable-libfdk-aac --enable-libkvazaar --enable-omx --cc=aarch64-linux-gnu-gcc --cxx=aarch64-linux-gnu-g++ --disable-altivec --shlibdir=/usr/lib/aarch64-linux-gnu
  libavutil      59. 39.100 / 59. 39.100
  libavcodec     61. 19.101 / 61. 19.101
  libavformat    61.  7.100 / 61.  7.100
  libavdevice    61.  3.100 / 61.  3.100
  libavfilter    10.  4.100 / 10.  4.100
  libswscale      8.  3.100 /  8.  3.100
  libswresample   5.  3.100 /  5.  3.100
  libpostproc    58.  3.100 / 58.  3.100
[rtsp @ 0x558f902cf0] method SETUP failed: 461 Unsupported Transport
Input #0, rtsp, from 'rtsp://127.0.0.1:40359':
  Metadata:
    title           : HomeKit Audio Talkback
  Duration: N/A, start: 0.000000, bitrate: N/A
  Stream #0:0: Audio: opus (libopus), 48000 Hz, stereo, s16
Stream mapping:
  Stream #0:0 -> #0:0 (opus (libopus) -> pcm_mulaw (native))
Press [q] to stop, [?] for help
Output #0, mulaw, to 'pipe:3':
  Metadata:
    title           : HomeKit Audio Talkback
    encoder         : Lavf61.7.100
  Stream #0:0: Audio: pcm_mulaw, 8000 Hz, mono, s16 (8 bit), 64 kb/s
      Metadata:
        encoder         : Lavc61.19.101 pcm_mulaw

[mulaw @ 0x55780a1db0] Estimating duration from bitrate, this may be inaccurate

[aist#0:0/pcm_mulaw @ 0x55780b92b0] Guessed Channel Layout: mono
Input #0, mulaw, from 'http://[REDACTED]@doorbird.internal:80/bha-api/audio-receive.cgi':
  Duration: 00:20:50.00, bitrate: 64 kb/s
  Stream #0:0: Audio: pcm_mulaw, 8000 Hz, mono, s16, 64 kb/s
Stream mapping:
  Stream #0:0 -> #0:0 (copy)
Output #0, mulaw, to 'pipe:3':
  Metadata:
    encoder         : Lavf61.7.100
  Stream #0:0: Audio: pcm_mulaw, 8000 Hz, mono, s16, 64 kb/s
Press [q] to stop, [?] for help

size=       4KiB time=00:00:00.51 bitrate=  61.5kbits/s speed=1.04x    
size=       8KiB time=00:00:00.99 bitrate=  62.7kbits/s speed=0.998x    
size=      12KiB time=00:00:01.49 bitrate=  63.1kbits/s speed=0.999x    
size=      15KiB time=00:00:01.99 bitrate=  63.4kbits/s speed=0.999x    
size=      20KiB time=00:00:02.51 bitrate=  63.5kbits/s speed=1.01x    
size=      23KiB time=00:00:03.01 bitrate=  63.6kbits/s speed=1.01x    
size=      27KiB time=00:00:03.51 bitrate=  63.6kbits/s speed=   1x    
size=      31KiB time=00:00:04.01 bitrate=  63.7kbits/s speed=   1x    
size=      31KiB time=00:00:04.03 bitrate=  63.7kbits/s speed=0.897x    
size=      31KiB time=00:00:04.03 bitrate=  63.7kbits/s speed=0.807x    
size=      31KiB time=00:00:04.03 bitrate=  63.7kbits/s speed=0.734x    
size=      31KiB time=00:00:04.03 bitrate=  63.7kbits/s speed=0.673x    
[HomeKit]: handleStreamRequest { sessionID: 'ce37c18c-5e7c-4d5e-9614-6daf08ae1083', type: 'stop' }
[HomeKit]: streaming session killed, duration: 25s
[HomeKit]: Stopping intercom.
[Rebroadcast Plugin]: default active rebroadcast clients: 0
Doorbird: audio transmitter finished.
[HomeKit]: ffmpeg exited
Doorbird: audio receiver ended.
Doorbird: Audio transmitter ended.

```

**Comment by nsowen** [comment]
One more thing:

Doorbird seems to be actively closing the RTSP stream after a few hours, but this seems not be picked up correctly by ffmpeg (?). The process just keeps lingering around and waits for more data that will never come.

```
Frame 3938468: 102 bytes on wire (816 bits), 102 bytes captured (816 bits)
Ethernet II, Src: BirdHomeAuto_e:ad:91 (1c:ca:e3:7e:ad:91), Dst: RaspberryPi_c8:bf:23 (2c:cf:67:c8:bf:23)
Internet Protocol Version 4, Src: 192.168.5.45, Dst: 192.168.5.225
Transmission Control Protocol, Src Port: 554, Dst Port: 35124, Seq: 1015932333, Ack: 173997, Len: 36
[2 Reassembled TCP Segments (40 bytes): #3938466(4), #3938468(36)]
RTSP Interleaved Frame, Channel: 0x01, 36 bytes
Real-time Transport Control Protocol (Sender Report)
    10.. .... = Version: RFC 1889 Version (2)
    ..0. .... = Padding: False
    ...0 0000 = Reception report count: 0
    Packet type: Sender Report (200)
    Length: 6 (28 bytes)
    Sender SSRC: 0xfa84b9aa (4203002282)
    Timestamp, MSW: 3961869369 (0xec255439)
    Timestamp, LSW: 2475735114 (0x9390b84a)
    [MSW and LSW as NTP timestamp: Jul 18, 2025 23:16:09.576427000 UTC]
    RTP timestamp: 1635552700
    Sender's packet count: 747331
    Sender's octet count: 1003841501
Real-time Transport Control Protocol (Goodbye)
    10.. .... = Version: RFC 1889 Version (2)
    ..0. .... = Padding: False
    ...0 0001 = Source count: 1
    Packet type: Goodbye (203)
    Length: 1 (8 bytes)
    Identifier: 0xfa84b9aa (4203002282)
    [RTCP frame length check: OK - 36 bytes]

```

I will try to analyze next if ffmpeg somehow ignores the BYE packet or maybe it's not even implemented to handle it in this case. Hopefully ffmpeg -loglevel trace will give more info on that.

**Comment by nsowen** [comment]
I created a change that addresses the issue that the Doorbird plugin hangs up. For anyone interested, you can checkout my branch here. Feedback appreciated:

https://github.com/nsowen/scrypted/tree/doobird/remove-http-auth/plugins/doorbird

... or check the plugin.zip here:

[plugin.zip](https://github.com/user-attachments/files/21464369/plugin.zip)

**Comment by stephanlinke87** [comment]
@nsowen Thanks for the incredible work on that! I installed it and so far, no hangs (D1101FV and D1101V) :) Gotta check the audio quality, but the echoeing seems to be gone. Great job :)
